freeze_account,"please allow my account to freeze"
freeze_account,"please put my account on hold"
freeze_account,"would you be able to freeze my bank account"
freeze_account,"please put a block on my citi account immediately"
freeze_account,"block my american saving bank for now"
freeze_account,"freeze my account for me"
freeze_account,"put a freeze on my account"
freeze_account,"i need to put a stop on my bank account"
freeze_account,"please put a stop on my bank account"
freeze_account,"please put a freeze on my banking account"
freeze_account,"i need my bank account frozen"
freeze_account,"would you freeze my bank account"
rollover_401k,"will my 401k carryover or not"
rollover_401k,"can my 401k rollover or not"
rollover_401k,"can the 401k i have be rolled over"
rollover_401k,"is there a way to roll over my 401k"
rollover_401k,"is it possible to rollover my 401k"
rollover_401k,"am i able to rollover my 401k"
rollover_401k,"how should i rollover my 401k"
rollover_401k,"how do i do a 401k rollover when switching to a new job"
rollover_401k,"i'm at a new job and i need to do a 401k rollover, how do i do this"
rollover_401k,"rolling over my 401k help"
rollover_401k,"rollover my 401k assistance"
rollover_401k,"i need help to roll over my 401k"
rollover_401k,"i have to roll over my 401k to a new account and i don't know how"
rollover_401k,"i just switched jobs and need a 401k rollover"
rollover_401k,"how can i rollover my 401k at my new job"
rollover_401k,"i desperately need to rollover my 401k somehow"
rollover_401k,"explain to me how to rollover my 401k"
rollover_401k,"can you assist me rolling over a 401k for a new job"
rollover_401k,"i need to get some assistance figuring out how i can rollover my 401k, please"
rollover_401k,"i have to transfer my 401k but i don't know how to do it"
rollover_401k,"i need help with my 401k rollver since i got a new job"
rollover_401k,"now that i have a new job, i need getting my 401k rolled over"
rollover_401k,"i have a new job and need direction with my 401k rollover"
rollover_401k,"i just got this new job but i need help with my 401k rollover"
rollover_401k,"i need assistance figuring out how to rollover my 401k, please"
rollover_401k,"is there a way to transfer my 401k"
rollover_401k,"i could use some help transfering my 401k"
rollover_401k,"look up whether my 401k may be rolled over"
rollover_401k,"i just started this new job and need help with my 401k rollover"
rollover_401k,"could you roll over my 401k for me"
rollover_401k,"i need to get some assistance figuring out how to rollover my 401k"
rollover_401k,"transfer my 401k please"
rollover_401k,"i have a new job now and need help with rolling over my 401k"
rollover_401k,"i recently got a new job and need assistance with my 401k rollover"
rollover_401k,"i'd like my 401k to be rolled over"
rollover_401k,"i got a new job, can you help me with my 401k rollover"
rollover_401k,"where do i go the transfer my 401k"
rollover_401k,"i heard i can transfer my 401k, but don't know how, do you"
rollover_401k,"i need some help with transferring my 401k, can you help"
rollover_401k,"i wanna transfer my 401k"
rollover_401k,"i must rollover my 401k"
rollover_401k,"i will rollover my 401k"
rollover_401k,"i need help to transfer my 401k"
rollover_401k,"how do i transfer my 401k to a new firm"
rollover_401k,"can i move my 401k to an ira"
rollover_401k,"how do i do a 401(k) rollover"
rollover_401k,"can 401ks be moved"
rollover_401k,"how can i transfer my 401k"
rollover_401k,"help me rollover my 401k"
rollover_401k,"what do i have to do to transfer my 401k"
who_made_you,"who is responsible for your design"
who_made_you,"who were you created by"
who_made_you,"what is the company that made you"
who_made_you,"who are you manufactured by"
who_made_you,"who makes you"
who_made_you,"who's your creator"
who_made_you,"what manufactures you"
who_made_you,"who brought you into existence"
who_made_you,"where were you programmed"
who_made_you,"tell me the company that produces you and similar machines"
who_made_you,"who invented you"
who_made_you,"i want to know who made you"
who_made_you,"to which company is your design accredited to"
who_made_you,"what company coded you"
who_made_you,"the programmer who made you is who"
who_made_you,"what company manufactured you"
who_made_you,"do you know who you came from"
who_made_you,"who was the inventor of ai"
who_made_you,"who made the ai"
who_made_you,"tell me what company programmed you"
who_made_you,"i need to know who programmed you"
who_made_you,"you were built by who"
who_made_you,"how were you made"
who_made_you,"give me an answer to who made you"
who_made_you,"would you tell me who made the ai"
who_made_you,"who supplied your instructions"
who_made_you,"what company created you"
who_made_you,"by which company are you designed by"
who_made_you,"can you remember who compiled you"
who_made_you,"who is your originator"
who_made_you,"who built you"
who_made_you,"who developed your actions"
who_made_you,"what's your brand"
who_made_you,"whats it like to be programmed"
who_made_you,"who designed you"
who_made_you,"who is this ai's creater"
who_made_you,"i'm needing to know who made you"
who_made_you,"what company owns your code"
who_made_you,"who is the person that brought you to life"
who_made_you,"who is the one that made you"
who_made_you,"who is your maker"
who_made_you,"i must know who programmed you"
who_made_you,"what was the company that designed you"
who_made_you,"let me know which company were you designed by"
who_made_you,"what company were you designed by"
who_made_you,"can you let me know what company were you designed by"
who_made_you,"tell me who made you please"
who_made_you,"can you tell me who made you"
who_made_you,"whats the name of the person who made you"
who_made_you,"what company did the design for this"
who_made_you,"what company did this design"
who_made_you,"what company is responsible for this design"
who_made_you,"for this design, what company did it"
who_made_you,"name the person or group that programmed you"
distance,"whats the travel time to redmond right now"
distance,"how long will the trip to portland be"
distance,"how long is it going to take me to get to bellevue"
distance,"how long will it take to get to tacoma"
distance,"how long is the drive to the closest gas station"
distance,"how much time to drive to the closest bank"
distance,"can you tell me the drive time to the nearest gas station"
distance,"i need to know how long it will take me to get to the bank"
distance,"what is the remaining time until we are at our destination"
distance,"how many miles away am i from madison square garden"
distance,"how long would it take to get to chicago by bus"
distance,"how long to seattle on a bus"
distance,"what is the average time it takes to get to target in los angeles"
distance,"can you please tell me how long it will take to get to target in austin"
distance,"how long will it take to get to phoenix"
distance,"i want to know the time to get to td bank in toms river"
distance,"how far is the grand canyon from my current location in phoenix, az"
distance,"what's the estimated time to get to ppg paints arena in pittsburgh via bus"
distance,"how long does it take to get to orlando by bus"
distance,"time taken from home to doctors office"
distance,"what time will we arrive at the bank"
distance,"how long is the ride to phoenix"
distance,"by bus, how long would it take to get to detroit"
distance,"tell me how far i am from home in time and miles"
distance,"how much time to reach doctors office"
distance,"how long will it take to get from galleria mall to state capitol"
distance,"how long is a bus ride to the library"
distance,"how miles does it take to get to red lobster from my current location"
distance,"how long can i expect a bus ride to the liberty bell to take"
distance,"i need a time update on the applebees trip"
distance,"how long will it take me to get to the mcdonald's in the city"
distance,"how many hours will it take to get to my destination"
distance,"if i leave now, how long will it take me to drive to cape hatteras"
distance,"how much time will pass between the start and end of our sojourn by bus to detroit"
distance,"how long will it take to get to long beach terminal from long beach airport"
distance,"how fast can i get to target in trenton"
distance,"what is the length of time it takes to get to phoenix"
distance,"what's the eta for grandma's house"
distance,"how long until i reach my destination"
distance,"which way do we go and how long will it take to get to the sears tower in chicago"
distance,"how many minutes will it take to get to the empire state building in manhattan"
distance,"what's the time to destination going via bus to omaha"
distance,"how many minutes am i from texaco"
distance,"how long will i be on the bus if i rid it to seattle"
distance,"is it going to be much longer until i reach the bank"
distance,"am i close to arriving at the post office"
distance,"what's the estimated travel time to get to dc via bus"
distance,"what's the average time to boston when riding a bus"
distance,"how long will i be on the bus to new orleans"
distance,"how long is a bus ride to staples"
distance,"how long does it take to get downtown by bus"
distance,"tell me how much longer i will have to drive to reach the destination"
distance,"how much farther is orlando from my location"
distance,"do i have a ways to go or am i close to getting to penn station"
distance,"please give me the approximate amount of time i will need to go from jfk international airport to penn station"
distance,"can you tell me about what time i should be arriving at the airport"
user_name,"do you know who i am"
user_name,"do you have my name programmed"
user_name,"is joey my name"
user_name,"tell me my name"
user_name,"tell me my name the way its saved"
user_name,"tell me what my name is"
user_name,"which way do you have my name saved"
user_name,"how does my name appear"
user_name,"how do you show my name"
user_name,"what is the name you would use for me"
user_name,"what name is saved for me"
user_name,"let me know what do you call me"
user_name,"what is my name saved under"
user_name,"what name do you have listed for me"
user_name,"you refer to me as what"
user_name,"you have what name for me"
user_name,"what am i called by you"
user_name,"what will you call me"
user_name,"whats my name saved under"
user_name,"what name am i under"
user_name,"i want you to let me know what names you have for me"
user_name,"what do you have my name saved under"
user_name,"what do you refer to me as"
user_name,"so what is my name saved as"
user_name,"please tell me the name you use for me"
user_name,"could you let me know what names you have for me"
user_name,"what is the name that you have for me"
user_name,"if you were smart, would you know my name"
user_name,"what is my name saved as"
user_name,"what is the name you have listed for my identity"
user_name,"do you know what you call me"
user_name,"can you tell me what you refer to me as"
user_name,"what's my name in your system"
user_name,"how do you usually refer to me"
user_name,"what is my first name saved as"
user_name,"what is the name that you have for me, please"
user_name,"would you tell me what names you have for me"
user_name,"do you know how to refer to me"
user_name,"you wrote what for my name"
user_name,"what name do you use when addressing me"
user_name,"what do you think i am called"
user_name,"what are you going to refer to me as"
user_name,"do you have any idea what my name is"
user_name,"how do you reference me"
user_name,"what can you call me"
user_name,"tell me what you think my name is"
user_name,"what is my name saved as in your system"
user_name,"let me know the name you have for me"
user_name,"what name do you use to talk about me"
user_name,"how do you refer to me"
user_name,"what do you think my name is"
user_name,"what do you think i'm called"
user_name,"what do you have for my name"
user_name,"how do you address my name"
user_name,"what's your designation"
user_name,"what do you call me"
user_name,"i want to hear my name"
user_name,"my name"
user_name,"what's my name"
user_name,"what name do you have for me"
user_name,"i need to know the name that you have for me"
user_name,"can you tell me what name you have for me"
user_name,"what is the name you have for me"
user_name,"could you tell me my name"
user_name,"do you have a name for me"
user_name,"can you tell me my name for me"
timezone,"what is the timezone of saigon"
timezone,"what timezone is hanoi in"
timezone,"what timezone do ho chi minh use"
timezone,"what timezone is paris in"
timezone,"which time zone is germany is in"
timezone,"which time zones does european countries use"
timezone,"what is the time zone of china"
timezone,"tell me the timezone for hong kong"
timezone,"which timezone contains the city of orlando"
timezone,"british columbia can be found in what timezone"
timezone,"in what timezone is atlanta located"
timezone,"what timezone is the country in"
timezone,"is the timezone there different"
timezone,"what's the timezone over there"
timezone,"what's london's timezone"
timezone,"what timezone is london in"
timezone,"please search for portland's timezone"
timezone,"what timezone is reno in"
timezone,"what is the timezone for quito"
timezone,"i need to know what timezone sedona is in"
timezone,"which timezone is france in"
timezone,"what timezone is lima in"
timezone,"french time zone"
timezone,"what is the time zone of france"
timezone,"i would like information on france's timezone"
timezone,"what timezone is japan in"
timezone,"tell me the timezone las vegas is in"
timezone,"what timezone is chicago in"
timezone,"whats the timezone for san fransico"
timezone,"tell me the timezone that spain is in"
timezone,"italy's timezone is what"
timezone,"do you know what the timezone is in reno"
timezone,"the timezone of italy is what"
timezone,"for italy what timezone is it in"
timezone,"in what timezone is nigeria"
timezone,"what timezone is detroit in"
timezone,"do you know what timezone italy is in"
timezone,"what timezone is scotland in"
timezone,"i wanna know what timezone spain is in"
timezone,"which timezone is england in"
timezone,"what timezone do they use in la"
timezone,"what's the time zone in miami"
timezone,"does the central timezone include austin"
timezone,"what timezone is los angeles in"
timezone,"what timezone is new york in"
timezone,"reno's timezone is what"
timezone,"what timezone is china in"
timezone,"what timezone is london is"
timezone,"what's the timezone for britain"
timezone,"i need la's time zone"
timezone,"i need to know britain's timezone"
timezone,"what is texas's timezone"
timezone,"tell me the timezone for california"
timezone,"what timezone would missouri be in"
timezone,"what timezone do they use in arizona"
timezone,"what is the timezone for san francisco"
timezone,"what is the timezone for paris"
timezone,"what is the timezone for houston"
timezone,"denver's timezone is what"
timezone,"does denver reside in the eastern timezones"
timezone,"which timezone is denver located"
timezone,"in which time zone does denver reside"
timezone,"what's the timezone now in hiram"
timezone,"timezone currently in mobile"
timezone,"what time is it in phoenix"
timezone,"can you give me the timezone for the country"
next_song,"i want you to skip past this song to the next track"
next_song,"please skip this song and go to the next one instead"
next_song,"would you skip past this song and just play what comes next"
next_song,"let's skip over this song and listen to the next tune instead"
next_song,"i want you to skip this song"
next_song,"i need for you to skip this song"
next_song,"please skip this song for me"
next_song,"would you skip this song"
next_song,"i am needing the next song to be played"
next_song,"i want the next song played"
next_song,"needing you to play the next song"
next_song,"next song please"
next_song,"change this song it sucks so bad"
next_song,"can you skip this song and go to the next one"
next_song,"what is the next song on this playlist"
next_song,"go to the next tune"
next_song,"go to my next song"
next_song,"hop to the next one"
next_song,"jump to the next song on this playlist"
next_song,"change the song to the next one on this playlist"
next_song,"go forward one song"
next_song,"go to next song, please"
next_song,"next song play"
next_song,"go forward to the next track"
next_song,"switch to the next song on this playlist please"
next_song,"you must skip this song and play the next one"
next_song,"play the next track"
next_song,"please put on the next number on this playlist"
next_song,"play the song coming on next"
next_song,"proceed to the next song on this playlist"
next_song,"stop this song and go to the next one"
next_song,"play the song after this"
next_song,"skip and play next song"
next_song,"i would like to hear the next tune on this particular playlist"
next_song,"please play the next song on this playlist"
next_song,"please play the next song"
next_song,"continue to next song on the playlist"
next_song,"play the next hit"
next_song,"advance to the next song"
next_song,"stop the current song and play the next one on this playlist"
next_song,"go to next song"
next_song,"play next on the playlist"
next_song,"i want to listen to the next song on this playlist instead"
next_song,"can we play the next track"
next_song,"can you skip this song"
next_song,"can we skip this song"
next_song,"can we stop this song and play the next one"
next_song,"i don't like this song, can skip it"
next_song,"can we move onto the next song"
next_song,"skip this song, please"
next_song,"can you swipe to the next song"
next_song,"next song, please!"
next_song,"go to the next song and play it"
next_song,"skip to next track"
next_song,"go to upcoming song"
next_song,"i dont want to listen to this song"
next_song,"could you hit next"
next_song,"can you go to the next song"
next_song,"maybe we can go to the next song"
next_song,"please can we go to the next song"
next_song,"might we go to the next song"
next_song,"next track"
next_song,"play next song"
next_song,"change this song please"
next_song,"i want you to play the next song"
transactions,"show me all video games purchased"
transactions,"list all purchases of video games"
transactions,"show me all new transactions"
transactions,"what transactions have i made in the last few weeks"
transactions,"how much money have i spent on restaurants"
transactions,"what transactions have i accrued buying dog food"
transactions,"what are my recent purchases"
transactions,"please let me review all items on my mastercard from this billing period"
transactions,"please tell me this month's transactions on my visa"
transactions,"show me all transactions for current statement"
transactions,"how many paypal transactions did i have last week"
transactions,"what transactions do i have on my visa from the last 4 weeks"
transactions,"what withdrawals were there on my account yesterday"
transactions,"was my last transaction at walmart"
transactions,"how much was my last transaction for"
transactions,"please give me my last ten debit card transactions in the month of december"
transactions,"on my card what all are my latest transactions"
transactions,"can you show me the transactions that were made last night at the restaurant"
transactions,"can i get my transactions for the date of the 23rd"
transactions,"help me get access to my recent transaction history"
transactions,"i need a recent transaction looked into"
transactions,"show me my transactions on clothes at macys"
transactions,"can i see my transactions on the 7th"
transactions,"please tell me all the transactions i've made recently"
transactions,"i need to know the transactions i made on the 10th"
transactions,"before i pay my capital one, what are the most recent transactions i've made"
transactions,"can you check on a transaction for me"
transactions,"show me transactions related to travel"
transactions,"show my transaction statement"
transactions,"let me check my transaction on my citi card"
transactions,"show me my transactions on make up at sephora"
transactions,"i need to know last months transactions"
transactions,"what did i buy last"
transactions,"can you list all recent transactions"
transactions,"what did i spend at target on my barclays card last month"
transactions,"i need to see my shopping transactions"
transactions,"can i see my transactions from yesterday"
transactions,"on my card what have been my recent purchases"
transactions,"show me the last month of transactions"
transactions,"when was my most recent transaction"
transactions,"show me the transactions made on my business card for supplies last quarter"
transactions,"how much did i spend on my most recent transaction"
transactions,"show me my ten most recent transactions on account xyz"
transactions,"i want to see all transactions in the past month for all accounts"
transactions,"show me my recent transactions from account xyz"
transactions,"open bank app and show my most recent transactions"
transactions,"are you able to find my recent transactions for me"
transactions,"i made a transaction recently"
transactions,"what was my recent transaction"
transactions,"i want to know what my recent transaction was"
transactions,"i need information about my recent transaction"
transactions,"state recent transaction"
transactions,"what have i spent things on"
transactions,"what were my last 10 charges on my credit card"
transactions,"show what i have spent things on"
transactions,"how much have i spent on my debit card this month"
transactions,"how much have i spent on my bank card sine i last paid my bill"
transactions,"what was my recent transaction on my visa card"
transactions,"what is the last transaction on my visa card"
transactions,"please review my recent visa card transaction"
transactions,"what is the largest transaction i have made on video games this month"
restaurant_suggestion,"where do you want to eat tonight"
restaurant_suggestion,"where is your favorite restaurant to eat"
restaurant_suggestion,"list a few pizza places that have seating near my current location"
restaurant_suggestion,"are there decent seafood restaurants in portland"
restaurant_suggestion,"name a few good steakhouses in chicago"
restaurant_suggestion,"does brooklyn have good italian restaurants"
restaurant_suggestion,"i would love to find a few vegan restaurants in back bay"
restaurant_suggestion,"suggest a few local eateries in mid price range"
restaurant_suggestion,"what are some good itialian restaurants in north salem"
restaurant_suggestion,"what are some good vegan restaurants in broadripple"
restaurant_suggestion,"what are some good mexican restaurants in indianapolis"
restaurant_suggestion,"what mexican restaurant within 5 miles has the best reviews"
restaurant_suggestion,"i'm hungry, where should i go"
restaurant_suggestion,"recommendations for good thai restaurants in las vegas"
restaurant_suggestion,"is there any good place for mexican food in hawaii"
restaurant_suggestion,"can you list off 4 star restaurants"
restaurant_suggestion,"i'm in the mood for italian, are there any good places around"
restaurant_suggestion,"what are some good sushi restaurants in reno"
restaurant_suggestion,"can you recommend a decent place in chicago to get pizza"
restaurant_suggestion,"where should i go for dinner"
restaurant_suggestion,"is there a barbecue restaurant around here"
restaurant_suggestion,"is there any good place in hawaii for pasta"
restaurant_suggestion,"can you tell me the best place for cajun shrimp in tampa"
restaurant_suggestion,"can you find me a good restaurant to try eating at"
restaurant_suggestion,"what decent restaurants around here are italian"
restaurant_suggestion,"give me some good restaurants"
restaurant_suggestion,"what's a highly rated place for steak in omaha"
restaurant_suggestion,"what are some good places to eat at"
restaurant_suggestion,"any new restaurants near the mall"
restaurant_suggestion,"could you locate me some good places in kentucky that serve sushi"
restaurant_suggestion,"i want to go out to eat but have no idea where to go, do you know of any places"
restaurant_suggestion,"do you know of any good restaurants"
restaurant_suggestion,"i am hungry and need a restaurant suggestion"
restaurant_suggestion,"could you direct me to any good places in kentucky that serve sushi"
restaurant_suggestion,"can you suggest some quality chinese restaurants in oklahoma city"
restaurant_suggestion,"any ideas on a good place to eat out"
restaurant_suggestion,"please list nearby restaurants with 4 or more star reviews"
restaurant_suggestion,"what's a good restaurant nearby"
restaurant_suggestion,"where's a good place to get some grub"
restaurant_suggestion,"can you list off different restaurants"
restaurant_suggestion,"i'm not going to cook today, can you suggest a restaurant"
restaurant_suggestion,"help me pick a nice restaurant to dine at"
restaurant_suggestion,"do you know of any good mexican restaurants in seattle"
restaurant_suggestion,"its date night and we cant decide where to go help"
restaurant_suggestion,"show me some restaurants that have high reviews for eating out"
restaurant_suggestion,"can you search recommended casual restaurants for tonight in philadelphia"
restaurant_suggestion,"where can i get some good food"
restaurant_suggestion,"can you find any good places in cleveland that serve clams"
restaurant_suggestion,"are there good clam places in cleveland"
restaurant_suggestion,"are there any good places in cleveland that serve clams"
restaurant_suggestion,"could you suggest a french restaurant, please"
restaurant_suggestion,"can you suggest a french restaurant, please"
restaurant_suggestion,"are there are any good places in washington that serve cheese pizza"
restaurant_suggestion,"what's the food can easily get in canada"
