smart_home,"turn on the microwave for 3 minutes"
smart_home,"set the tv on"
smart_home,"how is the temperature at ac"
smart_home,"the temperature at ac is what"
smart_home,"350 set the oven"
smart_home,"the oven be set at 350"
smart_home,"turn the oven to 350"
smart_home,"at ac, what's the temperature like"
smart_home,"ac temperature is at what"
smart_home,"turn on the tv"
smart_home,"to 350, set the oven"
smart_home,"can you adjust the lights down"
smart_home,"i want the light less bright please"
smart_home,"make the lights darker"
smart_home,"please set the temperature to 70 f"
smart_home,"set the oven temperature to 350"
smart_home,"i need the temperature set at 70 f"
book_hotel,"by chance would it be possible to reserve me a hotel in afghanistan at the zoo for the 10th to the 15th"
book_hotel,"could you book me a hotel in afghanistan at the zoo for the 10th to the 15th"
book_hotel,"could a hotel be booked for me in afghanistan at the zoo for the 10th to the 15th"
book_hotel,"i need to reserve a large room or suite for 2 couples for august 15th through august 18th in seattle"
book_hotel,"i need a hotel room for 7 people in st louis for november 3rd through 5th"
book_hotel,"i need a suite that can accommodate 3 adults and 1 child in san diego for may 15th, 16th, and 17th"
book_hotel,"show me a hotel in boise that has positive reviews"
book_hotel,"i need a hotel with good reviews in baltimore"
book_hotel,"find hotels in baltimore that have positive reviews"
book_hotel,"show me a hotel that has good reviews in kansas city"
book_hotel,"i am looking for a hotel in new york city that has good reviews"
book_hotel,"could you book me a hotel in tampa from may 2 to may 4"
book_hotel,"help me book a place to stay from may 2 to may 4 in tampa"
book_hotel,"book a motel in uptown from march 3 to march 4"
book_hotel,"find a hotel in san francisco for march 8 & 9"
book_hotel,"please book me a room in austin from tomorrow to the 2nd"
book_hotel,"what's a good hotel to stay at in chicago"
book_hotel,"can you find me a place to stay in sacramento near the capitol on july 3-5"
book_hotel,"i need a hotel booked in denver near the museum from friday to saturday"
book_hotel,"i need a bed in brownsburg near walmart from apil 4th until the 5th"
book_hotel,"find a columbus, ohio hotel with good reviews"
book_hotel,"is there a room big enough for 10 people from monday to tuesday in manhattan"
book_hotel,"what hotels are near, ny, ny for the 9th to 11th"
book_hotel,"show me a well reviewed hotel in evans"
book_hotel,"i need a room in indianapolis near the track from may 2nd through the 5th"
book_hotel,"find me a hotel in seattle with great reviews"
book_hotel,"in brooklyn, i need a hotel room for 4 from 3/15 until 3/20"
book_hotel,"book me a hotel in new york near the empire state building from marc 2nd to 4th"
book_hotel,"show me all hotels in evans with good reviews"
book_hotel,"i need a hotel room for 4 people in lakewood from monday to wednesday"
book_hotel,"i would like to reserve a hotel room that accomodates 10 people from monday to tuesday in manhattan"
book_hotel,"i need to book a hotel in ny, queens arrive on 8th and leave on the 13th"
book_hotel,"march 20th through the 22nd, please book me a hotel room in manhattan big enough for 10 people"
book_hotel,"will you find me a place to stay in casper from march 5th to march 11th"
book_hotel,"can you find me a hotel in columbus with good reviews"
book_hotel,"help me find a hotel in that has good reviews in columbus"
book_hotel,"help me find a good reviews hotel in la"
book_hotel,"i need a room in london for 2 people from march 1st to 3rd"
book_hotel,"find a suitable lodging in vancouver on march 16-19"
book_hotel,"i need a hotel in new orleans with awesome reviews"
book_hotel,"i need a well-rated hotel in vegas"
book_hotel,"i really need you to find me a hotel with good reviews in phoenix"
book_hotel,"i wanna book a place to stay in phoenix from the 5th to the 9th of march"
book_hotel,"i would like to book a place to stay in phoenix from the 5th to the 9th of march"
book_hotel,"i need a hotel in phoenix near chase field from january 4th to the 8th"
book_hotel,"i need a hotel room that is big enough for eleven people from march 10th to the 15th in phoenix"
book_hotel,"i must get a hotel in phoenix near chase field from january 4th to the 8th"
book_hotel,"go ahead and find me a hotel with good reviews in phoenix"
book_hotel,"i need you to find me a hotel with good reviews in phoenix"
book_hotel,"i need to get a hotel in phoenix near chase field from january 4th to the 8th"
book_hotel,"please book me a place to stay in phoenix from the 5th to the 9th of march"
book_hotel,"i need to book a place to stay in phoenix from the 5th to the 9th of march"
book_hotel,"i really gotta book a place to stay in phoenix from the 5th to the 9th of march"
book_hotel,"i need to get a hotel room that is big enough for eleven people from march 10th to the 15th in phoenix"
book_hotel,"can you find me a reputable hotel in honolulu"
book_hotel,"find for me a hotel with great reviews in ho chi minh"
book_hotel,"i need your help to find a good reviewed hotel in washington"
book_hotel,"can you find me a good reviewed hotel in japan"
book_hotel,"find me a place to stay in jacksonville near the stadium from january 1st through 3rd"
book_hotel,"book me a hotel in jacksonville near the stadium from january 1st to 3rd"
book_hotel,"find me a room near the jacksonville stadium between january 1st through january 3rd"
book_hotel,"get me a hotel room big enough for 4 people from may 3 to may 5 in boston"
book_hotel,"i need a hotel room for 4 people from may 3 to may 5 in boston"
current_location,"you need all five answers"
current_location,"i need to know what my gps coordinates are"
current_location,"tell me what to enter into my gps for my current location"
current_location,"i need to know the name of my current location for the tow truck"
current_location,"what is this place"
current_location,"where am i at currently"
current_location,"what are my coordinates"
current_location,"latitude and longitude please"
current_location,"location currently, where"
current_location,"how do i find my location right now"
current_location,"in the place i am what are my gps coordinates"
current_location,"please tell me my location using gps"
current_location,"what are my gps coordinates at this location"
current_location,"what's my current location"
current_location,"what are my gps coordinates right now"
current_location,"please tell me my current gps coordinates"
current_location,"let me know my current location"
current_location,"what do i do to find my current location"
current_location,"how will i find my current location"
current_location,"at this location what are my gps coordinates"
current_location,"how do i know where i'm at"
current_location,"check out my location up on the map"
current_location,"can i have my current gps coordinates"
current_location,"how do i find my location, please"
current_location,"where am i located currently"
current_location,"what street am i on right now"
current_location,"list my current gps coordinates"
current_location,"please show me where i am on a map"
current_location,"where am i right this moment"
current_location,"can you tell me how to figure out my current location"
current_location,"how can i go about finding my location right now"
current_location,"can you tell me my location"
current_location,"please tell me my current location"
current_location,"where am i right now, location wise"
current_location,"i'm lost"
current_location,"please locate me on the map and show me"
current_location,"how shall i find my current location"
current_location,"i need to find out how i know my location right now"
current_location,"use the map and pinpoint my position"
current_location,"please give me my gps coordinates"
current_location,"help me find where i am"
current_location,"where am i currently"
current_location,"what's my map location"
current_location,"find my current location"
current_location,"what's the location where i am"
current_location,"can you tell me my current location"
current_location,"i am currently located in what town"
current_location,"my current location is what"
current_location,"whats my location"
current_location,"show my position on the map"
current_location,"where is my location"
current_location,"current location please"
current_location,"display my location on the map"
current_location,"find out where i am on the map"
current_location,"where am i on the map"
current_location,"open map and pin point my location"
current_location,"where would i search for my location"
weather,"what's is the current weather forecast"
weather,"what's the forecast for the day"
weather,"weather forecast please"
weather,"i need to know today's forecast"
weather,"is it going to rain tomorrow"
weather,"what will be the weather tomorrow"
weather,"what's the humidity today"
weather,"what was the temperature yesterday"
weather,"what's today's high and low"
weather,"how cold is it in wisconsin today"
weather,"can you tell the temperature it will tomorrow"
weather,"what is the weather like in sparks right now"
weather,"costa mesa weather"
weather,"what will the low temperatures be over the weekend"
weather,"what is the high temperature for tomorrow"
weather,"what's the highest chance of rain for today"
weather,"what is the weather going to be like tomorrow"
weather,"how many of inches of snow did my hometown get last year"
weather,"what's the weather"
weather,"can you tell me the low tonight"
weather,"i need meteorological data for tallahassee"
weather,"what's the chance of rain on friday"
weather,"how cold will it be tomorrow"
weather,"will it snow this weekend"
weather,"is it going to rain tonight"
weather,"what are the conditions like in orlando"
weather,"how cold is it going to be tonight"
weather,"what's it doing outside right now"
weather,"can you let me know if it will be warm this week"
weather,"what is the record high temperature for today"
weather,"what is the temp right now"
weather,"what is the weather going to be like"
weather,"give me the 7 day forecast"
weather,"how's the weather"
weather,"is it snowing right now in richmond, va"
weather,"is it snowing in the next two weeks"
weather,"what will the weather be like"
weather,"costa mesa current weather"
weather,"what will the weather be this weekend"
weather,"what's the current weather"
weather,"tell me the weather report for tallahassee"
weather,"is it going to be sunny today"
weather,"what are the conditions like in sarasota"
weather,"what is the weather report for seattle"
weather,"what is the temperature in costa mesa"
weather,"what's the weekend forecast"
weather,"what's the weather like right now"
weather,"weather"
weather,"tell me the weather"
weather,"what's the weather like today"
weather,"show me what the weather is like"
weather,"let's take a look at the weather"
weather,"how is the weather looking in seattle"
weather,"what is the weather forecast looking like for seattle"
weather,"what is the weather doing now"
weather,"tell me what the weather is looking like"
weather,"how is the weather"
weather,"can you tell me the weather forecast"
weather,"could you tell me what the weather is in austin"
weather,"what about the weather in austin"
weather,"how is the weather in austin"
weather,"how is that weather"
weather,"need to know the weather now"
weather,"give weather update now"
weather,"want to know the weather"
weather,"what is the current weather like"
weather,"las vegas weather today"
taxes,"how much am i being taxed"
taxes,"what are my tax costs"
taxes,"what is my tax burden"
taxes,"can you tell me what my federal tax burden is"
taxes,"how much am i taxed each year"
taxes,"do you know how much i pay in taxes"
taxes,"how much do i pay in taxes every year"
taxes,"what's my federal tax this year"
taxes,"i need to know my tax rate"
taxes,"what is the tax rate that applies to me"
taxes,"how much do i need to pay in tax"
taxes,"what's my tax rate"
taxes,"tell me my tax rate"
taxes,"how much am i going to have to pay in federal taxes this year"
taxes,"how much did my state taxes change"
taxes,"can you tell me my income tax"
taxes,"what do i pay in taxes"
taxes,"how much will i pay in federal taxes"
taxes,"what amount do i have to pay in taxes"
taxes,"can you calculate my state taxes"
taxes,"using my salary as a basis, what taxes will i owe"
taxes,"what does it look like my state taxes will add up to"
taxes,"what's my bill going to be for my taxes for tennessee"
taxes,"what amount do my state taxes look like"
taxes,"give me the specifics on my federal taxes"
taxes,"i would like to know how much i pay in taxes"
taxes,"how much will i have to pay in state taxes"
taxes,"how much do i pay in taxes"
taxes,"how much money is the state going to take from me for taxes"
taxes,"how much do i owe for state taxes"
taxes,"what can i expect to pay in taxes"
taxes,"i need to know how much i should pay in tax"
taxes,"are my state tax payments too high"
taxes,"how much tax do i pay"
taxes,"how much does it seem my state taxes will be"
taxes,"what is the tax amount"
taxes,"what is the total amount of tax deductions from my income"
taxes,"how much is the irs going to get from me"
taxes,"please tell me what i pay in taxes"
taxes,"what are my state taxes looking like"
taxes,"what do i currently pay in taxes"
taxes,"how much tax do i owe"
taxes,"how much are taxes on this"
taxes,"help me calculate my federal tax bill"
taxes,"tell me how much in tax on this"
taxes,"what is the total amount i pay in taxes"
taxes,"what taxes do i owe"
taxes,"lets talk about what my federal taxes look like"
taxes,"what taxes will i owe from my income"
taxes,"what do my federal taxes look like"
taxes,"how much are the taxes on my income"
taxes,"please share my federal taxes total with me"
taxes,"how much in taxes will i owe"
taxes,"tell me how much my state taxes amount to"
taxes,"whats the total of my federal taxes"
taxes,"look up how much my state taxes are"
taxes,"talk to me about the total of my state taxes"
taxes,"what is the total of my state taxes"
taxes,"how much do i owe the irs"
taxes,"do you know my state tax total"
taxes,"what's the amount of taxes for my income"
taxes,"how much are my taxes for my income"
taxes,"i pay how much of taxes with my income"
taxes,"how much is my state taxes"
taxes,"i need the data and price from my state taxes"
taxes,"do you know the price for my taxes in income"
taxes,"what is the price of my state taxes that i owe"
taxes,"do you know the total for taxes for my income"
taxes,"what should i squirrel away to pay in taxes"
min_payment,"what is the minimum amount due on my cable bill"
min_payment,"what is the minimum payment"
min_payment,"whats the minimum payment on my electric bill"
min_payment,"what is the least i can pay towards my car bill"
min_payment,"what's the least i can pay towards this bill"
min_payment,"how little can i pay towards my car insurance"
min_payment,"is there a minimum amount accepted"
min_payment,"what would be the least i could pay on this bill"
min_payment,"what's the least amount i can pay on this bill"
min_payment,"what's the minimum payment on my bill"
min_payment,"what's my bill's minimum payment"
min_payment,"i'd like to know my minimum payment please"
min_payment,"lowest amount for cable bill"
min_payment,"what is the minimum payment due on my visa"
min_payment,"what is the smallest payment i can make toward my xfinity bill"
min_payment,"what is the minimum i need to pay for my cell phone bill"
min_payment,"i would like to know the minimum payment for my credit card"
min_payment,"please tell me the minimum i can pay on my electric bill"
min_payment,"what is the smallest i can pay on the water bill"
min_payment,"show my my minimum payment for youtube"
min_payment,"what is the minimum payment for my credit card bill"
min_payment,"what is the lowest amount i can pay for my cable bill"
min_payment,"show me the minimum payment for my boat bill"
min_payment,"what is my bill's minimum payment"
min_payment,"tell me the minimum payment of my bill"
min_payment,"i would like to know my water bill minimum payment"
min_payment,"pay the minimum payment for m and t bill"
min_payment,"how small of a payment can i make for my chase card bill"
min_payment,"how tiny a payment can i make on electric bill"
min_payment,"what's the least amount i need to pay on the electric bill"
min_payment,"what's the smallest amount i can pay on the water bill"
min_payment,"what's the least i can pay on the medical payments for february"
min_payment,"how much is the minimum payment on my chase card"
min_payment,"how much is the least i can pay for power bill"
min_payment,"find the minimum due on my peco energy bill for february"
min_payment,"what is the smallest amount i can pay on my tmobile bill"
min_payment,"please lookup the minimum i need to pay on my credit card"
min_payment,"the bill's minimum payment, what is it"
min_payment,"i want you to tell me the minimum i can pay on my rent bill"
min_payment,"let me know the minimum i can pay on my cable bill"
min_payment,"tell me the minimum i can pay on my cable bill"
min_payment,"inform me the lowest amount i can pay for my cable bill"
min_payment,"what's the minimum payment for our cc bill"
min_payment,"what is the minimum i can pay for my light bill"
min_payment,"at a minimum, what must i pay on my verizon bill"
min_payment,"what must i pay, at a minimum, on my verizon bill"
min_payment,"what is my amex minimum payment"
min_payment,"what's the minimum payment"
min_payment,"what is my minimum payment and when is it due"
min_payment,"is there a minimum payment i can make"
min_payment,"what is the lowest amount i can pay for my cellphone bill"
min_payment,"what is the lowest amount i can pay for my insurance bill"
min_payment,"what is the minimum i can pay on my credit card bill"
min_payment,"what is the lowest amount i can pay for my medical bill"
min_payment,"what is the minimum i can pay on my phone bill"
min_payment,"what is the minimum i can pay on my gas bill"
min_payment,"what is the lowest amount i can pay for my car bill"
min_payment,"what is the minimum i can pay on my water bill"
min_payment,"tell me the minimum i can pay on my utilities bill"
min_payment,"look up the lowest amount i can pay on my electricity bill"
whisper_mode,"set up whisper mode"
whisper_mode,"how do i go to whisper mode"
whisper_mode,"change over to whisper mode"
whisper_mode,"take me out of whisper mode"
whisper_mode,"i want to be out of whisper mode"
whisper_mode,"use your whisper voice"
whisper_mode,"can you please whisper"
whisper_mode,"make a switch to whisper mode"
whisper_mode,"whisper please"
whisper_mode,"go into whisper mode"
whisper_mode,"put whisper mode on"
whisper_mode,"please use whisper mode"
whisper_mode,"i want whisper mode to be switched off"
whisper_mode,"let's switch out of whisper mode"
whisper_mode,"i want your setting adjusted to whisper voice now"
whisper_mode,"go into whisper mode now please"
whisper_mode,"exit out of whisper mode"
whisper_mode,"immediately begin using whisper mode"
whisper_mode,"turn on the whisper voice"
whisper_mode,"please turn on whisper mode because i am about to be in class"
whisper_mode,"go into whisper mode now"
whisper_mode,"can you whisper until i tell you not to"
whisper_mode,"i need you to switch to whisper mode"
whisper_mode,"please turn on whisper mode"
whisper_mode,"please talk quietly"
whisper_mode,"please shut off whisper mode for now"
whisper_mode,"can you please lower the volume please"
whisper_mode,"i want to switch out of whisper mode"
whisper_mode,"i want you to be in whisper mode now because i am in the library"
whisper_mode,"whisper from now on"
whisper_mode,"please speak with the whisper voice"
whisper_mode,"start using whisper mode"
whisper_mode,"please switch to whisper mode for now"
whisper_mode,"talk in whisper voice"
whisper_mode,"i decide to switch out of whisper mode"
whisper_mode,"can you switch to whisper mode"
whisper_mode,"i want you to use whisper voice now"
whisper_mode,"set whisper mode to off"
whisper_mode,"switch whisper mode off"
whisper_mode,"turn whisper mode off"
whisper_mode,"whisper mode, please"
whisper_mode,"please start whisper mode"
whisper_mode,"leave whisper mode"
whisper_mode,"revert from whisper mode"
whisper_mode,"whisper mode must be left"
whisper_mode,"change from whisper mode"
whisper_mode,"help to turn on whisper mode"
whisper_mode,"start whisper mode"
whisper_mode,"make saound function operate in whisper mode"
whisper_mode,"change audio settings to the whisper option"
whisper_mode,"change audio to whisper mode"
whisper_mode,"i want to only use the whisper sound"
whisper_mode,"change sound setting to whisper"
whisper_mode,"cancel whisper mode"
cancel,"quit talking"
cancel,"stop please"
cancel,"whats the procedure to cancel it"
cancel,"stop it"
cancel,"please abort the current process"
cancel,"cancel it"
cancel,"can you cancel it"
cancel,"command cancel"
cancel,"please stop it"
cancel,"how to cancel"
cancel,"i repeat cancel"
cancel,"don't talk anymore"
cancel,"i need you to stop talking"
cancel,"rescind"
cancel,"i advise you to quit talking"
cancel,"stop"
cancel,"shhhh"
cancel,"mute"
cancel,"that's enough, don't say anymore please"
cancel,"cancel that last command"
cancel,"never mind, don't do that"
cancel,"i don't want you to speak any more for now"
cancel,"oh shut the hell up would you"
cancel,"cancel my last request, i know the answer"
cancel,"can you end the task"
cancel,"refrain from talking"
cancel,"undo"
cancel,"nevermind, cancel that"
cancel,"no more talking"
cancel,"undo this process"
cancel,"don't continue with what you're doing"
cancel,"ai, cancel that last request"
cancel,"halt"
cancel,"cancel action"
cancel,"quiet now"
cancel,"i would like you to stop what you were doing"
cancel,"can you stop speaking"
cancel,"please cancel the input"
cancel,"stop and go back"
cancel,"i need you to stop talking now"
cancel,"abort"
cancel,"please abandon the current job"
cancel,"cancel that"
cancel,"abort the current action"
cancel,"oops cancel that"
cancel,"don't do this process"
cancel,"ai, stop talking"
cancel,"actually forget that i don't need it"
cancel,"stop what you're doing"
cancel,"this process needs to stop"
cancel,"stop this process"
cancel,"that was a mistake, undo that"
cancel,"ignore the previous command"
cancel,"please cancel the last input"
cancel,"please stop the current process"
cancel,"please stop talking"
cancel,"stop, just stop"
cancel,"can you turn off the process"
cancel,"you can cancel the task"
cancel,"can you cancel that request"
cancel,"could you cancel that request, please"
cancel,"hush"
cancel,"be quiet"
cancel,"stop it now!"
cancel,"you need to shut it"
cancel,"stop processing"
cancel,"stop speaking"
international_visa,"if i plan on travelling to this country, do i need a visa"
international_visa,"for going to that country, do i need a visa"
international_visa,"does one need a visa to go there"
international_visa,"does going to taiwan require me to get an international visa"
international_visa,"if i go to brazil, do i need to get an international visa"
international_visa,"is an international visa needed to go to cyprus"
international_visa,"i want to go to china but am not sure if i need an international visa"
international_visa,"should i get an internation visa to go to switzerland"
international_visa,"is an international visa needed for canada"
international_visa,"if i go to uganda, do i need an international visa"
international_visa,"am i going to need a visa for traveling to canada"
international_visa,"does the uk require a travel visa"
international_visa,"i want to go to korea, do i need an international visa"
international_visa,"do i need an international visa to go to spain"
international_visa,"does mexico require an international visa"
international_visa,"does travelling to that place require a visa"
international_visa,"do i need a visa to travel to canada"
international_visa,"do i need a visa to russia"
international_visa,"do i need to obtain a travel visa to go on vacation to places in eastern europe"
international_visa,"let me know if i need an international visa to go to sudan"
international_visa,"do i need a visa to travel to jamaica"
international_visa,"i'm going to canada soon, do i need a visa"
international_visa,"should i get a travel visa for spain"
international_visa,"i want to see paris will i need an international visa"
international_visa,"do i need to apply for a visa to visit dnipro"
international_visa,"for travel to argentina, do i need to get a travel visa"
international_visa,"if i want to travel to mexico do i need to get a visa"
international_visa,"tell me whether i need an international visa to go to mexico"
international_visa,"do i have to get an international visa before they'll let me in melbourne"
international_visa,"does france have their own version of a visa"
international_visa,"might i need to get a visa to travel to venezuela"
international_visa,"israel has strict restrictions do i need a visa to travel there"
international_visa,"am i in need of an international visa to go to france"
international_visa,"do i need a visa to travel to mexico"
international_visa,"do i need a visa to travel to isreal"
international_visa,"would i need a tourist visa for brazil"
international_visa,"will i have to apply for a visa if i want to visit mexico"
international_visa,"does international travel always require a visa"
international_visa,"do i need a visa to go to greece"
international_visa,"i'm going to jamaica next week; am i needing a visa"
international_visa,"if i'm planning to go to the uk, do i need a visa"
international_visa,"do i need a visa to go to somewhere internationally"
international_visa,"i am going to russia and am wondering if i need a visa"
international_visa,"do i need an international visa to go to malaysia"
