cook_time,"how long do i need to cook roast for"
cook_time,"how long does it take to cook hot pockets"
cook_time,"what's the recommended cooking time for steak"
cook_time,"how long does it take to make roast chicken"
cook_time,"how long to reheat chinese food"
cook_time,"how long do you need to put the cuish in for"
cook_time,"how long should i wait before i can bake bread with homemade dough"
cook_time,"tell me how long i ought to spend preparing fajitas"
cook_time,"how long does it take to cook roast beef"
cook_time,"about how long should you cook a 10 pound turkey"
cook_time,"how many minutes do i cook baked ziti"
cook_time,"for how long should i bake the brownies"
cook_time,"how long should i boil noodles for"
cook_time,"how long does it take to cook a pork chop"
cook_time,"what's the time it takes to make a decent omelette"
cook_time,"i need to know how long to do a pot roast in a slow cooker"
cook_time,"so how long do you think the chicken will take"
cook_time,"how long should this be in the oven"
cook_time,"how long to cook a frozen pizza"
cook_time,"what's the preparation time for spaghetti"
cook_time,"what amount of time do i need to cook lobster for"
cook_time,"what's the prep time for a garden salad"
cook_time,"how long do the brownies need to be in the oven"
cook_time,"how long am i supposed to cook pork loin"
cook_time,"how long does it take to bake a pork loin"
cook_time,"how long should i cook the asparagus for"
cook_time,"how long should a cake bake"
cook_time,"how long will it take to fix shepherd's pie"
cook_time,"how long do you cook a hamburger for"
cook_time,"how long should i cook a ny steak"
cook_time,"how long does it take to cook ham"
cook_time,"how long do noodles need to cook"
cook_time,"what is the duration of time cookies should be in the oven"
cook_time,"how long to i bake the brownies"
cook_time,"how long do i need to make lasagne"
cook_time,"how long to grill thick steaks"
cook_time,"how long does pizza take"
cook_time,"lasagna takes how long to cook"
cook_time,"bake time for brownies"
cook_time,"what is the proper cooking time for this"
cook_time,"look up recipe time for this"
cook_time,"how many minutes should i put meal the cake in the oven"
cook_time,"when can i expect meal of salmon to be finished"
cook_time,"tell me how long it will take to prepare a lasagna"
cook_time,"i want to cook a lasagna please tell me how long it will take"
cook_time,"how long does it take to prepare a lasagna"
cook_time,"how long do i need to cook chicken"
cook_time,"how long should i bake a cake"
cook_time,"how long does it take to cook steaks"
cook_time,"how long does it take to bake a cake"
cook_time,"how long should i cook my turkey"
cook_time,"how long does it take to make mashed potatoes"
cook_time,"what are the minutes needed to cook the meal"
reminder_update,"remind me to call my mom"
reminder_update,"remind me to get an oil change"
reminder_update,"remind me to write that letter"
reminder_update,"remind me to do something"
reminder_update,"you need to remind me to do something"
reminder_update,"i need to be reminded"
reminder_update,"can you set a reminder for me"
reminder_update,"i just put steaks on the grill remind me to check them at the right time"
reminder_update,"don't let me forget to check the steak"
reminder_update,"can you set a reminder for the current time tommorow"
reminder_update,"can i have a reminder set up"
reminder_update,"tell me to take out the trash in an hour"
reminder_update,"make me a reminder that tommorow is trash day"
reminder_update,"set a reminder for me to call my brother at 8 pm"
reminder_update,"can i set a reminder"
reminder_update,"set a reminder to go grocery shopping"
reminder_update,"remind me to take the chicken out in a hour"
reminder_update,"please remind me of something"
reminder_update,"set a reminder to go check the mail"
reminder_update,"how about a reminder"
reminder_update,"set a reminder to feed the dogs"
reminder_update,"set up a reminder that i need to pay my car ins the 23rd"
reminder_update,"i need to make a reminder please"
reminder_update,"remind me to bring a jacket in tomorrow"
reminder_update,"make a reminder for me to do my resume"
reminder_update,"make a reminder to do my taxes"
reminder_update,"set a reminder for me to do this in a bit"
reminder_update,"make reminder to pay rent on the 30th of every month"
reminder_update,"i want you to remind me of something"
reminder_update,"make a reminder to give the cat her flea medicine"
reminder_update,"remind me to call bob"
reminder_update,"can you set me a reminder"
reminder_update,"set a reminder for monday pay taxes"
reminder_update,"set reminder to prepare for my meeting at 10 am"
reminder_update,"please remind me later"
reminder_update,"remember to remind me of this later"
reminder_update,"remind me tommorow at 3pm i have a doctors appointment"
reminder_update,"set a new reminder for tomorrow at 4am"
reminder_update,"please reminder for car meet"
reminder_update,"i need to set a reminder to go to the post office"
reminder_update,"set reminder pay taxes on monday"
reminder_update,"remind me to take out the trash"
reminder_update,"don't forget to tell me to call my mother"
reminder_update,"remind me to put gas in my car"
reminder_update,"set a reminder to buy bread"
reminder_update,"make a reminder to pay my cable bill today"
reminder_update,"i need a reminder to give the dog his medicine at ten tonight"
reminder_update,"i don't want to forget to call mom"
reminder_update,"i need a reminder to wash dishes"
reminder_update,"help me to remember to pick up stan later"
reminder_update,"tell me later to call bill"
reminder_update,"please set up a reminder for me"
reminder_update,"i need a reminder to take dinner out of the oven"
reminder_update,"create a new reminder to study for my final exams"
reminder_update,"i need a reminder to alert me to wish my mom a happy birthday"
reminder_update,"are you able to remind me about something"
reminder_update,"set up a reminder so i don't forget the baby shower this weekend"
reminder_update,"i need to set a reminder to call lisa for her birthday"
reminder_update,"can you set a reminder alarm for me to workout"
reminder_update,"please set a reminder for me to put the clothes in the dryer"
report_lost_card,"my card is lost, i would like to report it"
report_lost_card,"how do i report a stolen card"
report_lost_card,"what is the process of reporting a lost card"
report_lost_card,"report a card lost for me"
report_lost_card,"i have a card that was lost i need to report"
report_lost_card,"amazon visa card is stolen"
report_lost_card,"my disney visa card is stolen"
report_lost_card,"what are the steps to take to report a lost card"
report_lost_card,"what is the route to take to report a lost card"
report_lost_card,"i need the information on how to report a lost card"
report_lost_card,"my card is lost and i need to know how to report it"
report_lost_card,"who do i report card theft to"
report_lost_card,"what do i do to report a lost card"
report_lost_card,"i am obliged to report my stolen card"
report_lost_card,"my capital one credit card was stolen"
report_lost_card,"my american express card needs to be reported as stolen"
report_lost_card,"my credit card has been stolen, please report it"
report_lost_card,"i want to report my card as lost"
report_lost_card,"my card is lost please report it"
report_lost_card,"what should i do if my card is lost"
report_lost_card,"i need to report my stolen card"
report_lost_card,"my visa card was stolen"
report_lost_card,"could you please help me, my card has been stolen and i need to report it"
report_lost_card,"my stolen card needs to be reported"
report_lost_card,"i lost my card how do i report it"
report_lost_card,"someone stole my mastercade"
report_lost_card,"i need to replace my lost card"
report_lost_card,"my visa card got stolen"
report_lost_card,"i have to report my card as stolen"
report_lost_card,"oh no, report my card, it's stolen"
report_lost_card,"i can't find my insurance card and i want to report it as lost"
report_lost_card,"someone stole my discover card"
report_lost_card,"i lost my card, what do i do"
report_lost_card,"i would like to report my card as stolen, please"
report_lost_card,"i need to report credit card theft"
report_lost_card,"i think my card is stolen and needs to be reported"
report_lost_card,"what do i do if i lost my card"
report_lost_card,"report my lost visa card"
report_lost_card,"i need to tell you about my lost card"
report_lost_card,"where do i report that my card was lost"
report_lost_card,"who do i speak with about my card that was lost"
report_lost_card,"please help me report my lost card"
report_lost_card,"set up a report for a lost card"
report_lost_card,"what is the process for reporting my card as lost"
report_lost_card,"please tell me how to go about reporting a lost card"
report_lost_card,"search steps for how to report a card lost"
report_lost_card,"i need to to know how to report a lost card"
report_lost_card,"my capital one visa was taken without permission"
report_lost_card,"i need to report that someone ran off with my td bank card earlier"
report_lost_card,"what steps do i need to take to report a card lost"
report_lost_card,"how do i report that i lost my card"
report_lost_card,"how do i report that i actually lost my card"
report_lost_card,"how do i report my very lost card"
report_lost_card,"how do i report the card as lost"
report_lost_card,"lost report card, need new one"
report_lost_card,"my report card was stolen"
report_lost_card,"my report card was lost help!"
ingredient_substitution,"would it be a problem to sub chips instead of fries"
ingredient_substitution,"is it normal to use mayo instead of cheese"
ingredient_substitution,"can i sub ketchup for mustard"
ingredient_substitution,"i wonder if it would be possible to switch from apples to grapes"
ingredient_substitution,"is it okay to switch apples for grapes"
ingredient_substitution,"can i modify the apples for grapes"
ingredient_substitution,"would i be able to swap apples for grapes"
ingredient_substitution,"i don't have butter can i use oil"
ingredient_substitution,"is butter a substitute for oil"
ingredient_substitution,"are butter and oil interchangable"
ingredient_substitution,"do you know if i can use pepper and not salt"
ingredient_substitution,"would it be ok if i have pepper and not salt"
ingredient_substitution,"can i use pepper instead of salt"
ingredient_substitution,"is it okay to switch water for milk"
ingredient_substitution,"i don't have sour cream, can i use yogurt instead"
ingredient_substitution,"can i use yogurt in place of sour cream"
ingredient_substitution,"could i use olive oil instead of grape seed oil"
ingredient_substitution,"can i substitute apple juice for wine"
ingredient_substitution,"are you able to sub white sugar for brown sugar"
ingredient_substitution,"please allow me to swap salt for baking soda"
ingredient_substitution,"can i substitute bacon for sausage"
ingredient_substitution,"can i use milk instead of cream"
ingredient_substitution,"can i exchange milk for cream in recipes"
ingredient_substitution,"can i substitute yogurt for sour cream"
ingredient_substitution,"can i substitute honey for sugar"
ingredient_substitution,"can i use sour cream instead of yogurt"
ingredient_substitution,"can i use sour cream in place of creme fraiche"
ingredient_substitution,"is it acceptable to swap milk for water"
ingredient_substitution,"what can i use as a substitute for yeast"
ingredient_substitution,"can i use salt instead of baking soda"
ingredient_substitution,"can you sub half and half for heavy whipping cream"
ingredient_substitution,"is it acceptable to swap chicken for pork"
ingredient_substitution,"is it acceptable to swap salt for baking soda"
ingredient_substitution,"is it possible to use sausage instead of hot dog"
ingredient_substitution,"i wanna swap salt for baking soda"
ingredient_substitution,"can i swap coconut milk for condensed milk"
ingredient_substitution,"is it acceptable to swap marinara for alfredo"
ingredient_substitution,"can i use olive oil instead of butter"
ingredient_substitution,"is it ok to sub sugar for salt"
ingredient_substitution,"it is okay to replace water instead of milk"
ingredient_substitution,"is it ok to use brown sugar instead of powdered sugar"
ingredient_substitution,"can i use almond milk instead of rice milk"
ingredient_substitution,"can i substitute eggs for milk in a recipe"
ingredient_substitution,"can i substitute ginger for garlic"
ingredient_substitution,"can i swap yogurt for sour cream"
ingredient_substitution,"i wanna sub sugar for salt"
ingredient_substitution,"can i swap chili for sloppy joe mix in the recipe"
ingredient_substitution,"can i use apples instead of oranges in this recipe"
ingredient_substitution,"can i use skim milk instead of 2% in the recipe"
ingredient_substitution,"can i use lettuce instead of rice"
ingredient_substitution,"is it possible to use baking soda instead of flour"
ingredient_substitution,"can i just use oil instead of vinegar"
ingredient_substitution,"will this recipe still be good if i use milk instead of eggs"
ingredient_substitution,"can i use regular olive oil instead of virgin"
ingredient_substitution,"is it possible to use starch instead of flour"
ingredient_substitution,"is it okay to use butter instead of margarine"
ingredient_substitution,"will it be ok to sub turkey for beef"
ingredient_substitution,"is it okay to use applesauce instead of oil"
ingredient_substitution,"if i use applesauce instead of oil, will that mess it up"
ingredient_substitution,"will it still work if i use applesauce instead of oil"
ingredient_substitution,"would it be ok to use butter instead of oil"
ingredient_substitution,"could steak be used instead of chicken"
ingredient_substitution,"can i use red onions instead of white"
ingredient_substitution,"can i get peppers instead of onions"
make_call,"please call mark"
make_call,"i want to call mark"
make_call,"let me call mark"
make_call,"call back my mom please"
make_call,"start a call to cynthia"
make_call,"i want to call up jan"
make_call,"please initiate a phone call to my boss"
make_call,"initiate a call to robert"
make_call,"call contact aj"
make_call,"call aj now"
make_call,"call my friend aj"
make_call,"can you call michelle on the home phone"
make_call,"call sandra right now"
make_call,"phone christie"
make_call,"call friend"
make_call,"i am going to call the landlord"
make_call,"place a call to bill now"
make_call,"call someone"
make_call,"dial someone's phone number"
make_call,"call mark"
make_call,"connect me to bob"
make_call,"initiate a phone call with receptionist"
make_call,"call erryn"
make_call,"x is waiting for me to call"
make_call,"use my phone to dial work"
make_call,"call robby for me"
make_call,"call robby"
make_call,"i want to talk to sarah"
make_call,"put me on a call to sally"
make_call,"dial steven"
make_call,"can you make a phone call to roger"
make_call,"please phone lizzy"
make_call,"dial lisa's cell phone number"
make_call,"i must call roderick"
make_call,"phone sarah"
make_call,"please make a phone call to christopher"
make_call,"phone lobby"
make_call,"can you call a taxi"
make_call,"can i call a restaurant"
make_call,"i have to call jane"
make_call,"please dial christie's number"
make_call,"i need to call my dad"
make_call,"i need to call my friend"
make_call,"i need to call my coworker"
make_call,"i need to call my mom"
make_call,"i need to call my boss"
make_call,"i need you to call the phone company for me"
make_call,"make a call for me to the vet"
make_call,"dial up dominos pizza"
make_call,"get mom on the phone"
make_call,"use phone to call alexa"
make_call,"computer, place a call to alexa"
make_call,"can you call alexa"
make_call,"call alexa at home"
make_call,"i would like to make a phone call"
make_call,"can i make a phone call"
make_call,"i need to call sal"
make_call,"i have to make a phone call"
make_call,"i have to use the phone to make a call"
make_call,"could you call sal"
make_call,"call sal"
make_call,"dial her up"
alarm,"set an alarm for 235pm and another an hour later"
alarm,"please add alarms at 430am and 1030am"
alarm,"set my alarm for eight tomorrow, please"
alarm,"set my alarm for five tomorrow morning, please"
alarm,"set an alarm for four thirty tomorrow, please"
alarm,"set me an alarm right now"
alarm,"set an alarm for me please"
alarm,"please set me an alarm"
alarm,"set me an alarm now"
alarm,"i need an alarm set for ten pm and midnight"
alarm,"can you set up alarms for one in the afternoon and ten at night"
alarm,"at 9 tomorrow, set off the alarm"
alarm,"set my alarm for 6am tomorrow"
alarm,"wake me up at 6 am"
alarm,"please set alarm for me"
alarm,"set up an alarm"
alarm,"i'd like a new alarm set for 6am"
alarm,"set an alarm to go to sleep and another to wake up"
alarm,"i want an alarm at 5pm"
alarm,"set an alarm to start work and another to stop"
alarm,"i want an alarm to go off at 9 am"
alarm,"can you play an alarm at 5pm"
alarm,"set me an alarm for 4pm and another for 5pm"
alarm,"i need you to set alarm for me"
alarm,"i need an alarm set"
alarm,"create an alarm for me"
alarm,"create alarm"
alarm,"i need you to schedule an alarm"
alarm,"please create an alarm for 5:45 am and an alarm for 6:15 am"
alarm,"tomorrow i would like an alarm for 9 tomorrow"
alarm,"set an alarm for lunch and another for dinner"
alarm,"create an alarm for 9 am and another one for 11 am"
alarm,"make up a new alarm"
alarm,"can you make an alarm for 7 am"
alarm,"i need an alarm set for 9 am and another for 11 am"
alarm,"please set up an alarm to go off tomorrow at daybreak"
alarm,"please set an alarm for 2 pm for me"
alarm,"i need an alarm set please"
alarm,"could you set one alarm for 8am saturday and one for 9am sunday"
alarm,"i want to set an alarm"
alarm,"set an alarm for 6 am tomorrow"
alarm,"set an alarm for 8 tomorrow"
alarm,"i'd love to set an alarm"
alarm,"i want an alarm set"
alarm,"set an alarm for ten tomorrow"
alarm,"i want an alarm for 6 am"
alarm,"i wanna have an alarm"
alarm,"i need an alarm set now"
alarm,"can you set the alarm for noon"
alarm,"can you wake me up at noon"
alarm,"set alarm for noon"
alarm,"set an alarm for 5am"
alarm,"please make sure the alarm is set"
alarm,"set the alarm now"
alarm,"i need an alarm"
todo_list,"repeat my to do list"
todo_list,"will you please tell me my to do list"
todo_list,"did i put cutting the grass on my todo list"
todo_list,"is there anything on my todo list for taking out the trash"
todo_list,"is cleaning the outside windows on my todo list"
todo_list,"have i added anything to my todo list"
todo_list,"did i make a note on my todo list to mop the bathroom floor"
todo_list,"is my todo list free"
todo_list,"can you tell me if there is anything on my todo list"
todo_list,"did i put a car wash on my todo list"
todo_list,"is vacuuming on my todo list"
todo_list,"does my todo list have vacuuming on it"
todo_list,"is cleaning the garage on my to do list"
todo_list,"i need to know if sorting the mail is on my to do list"
todo_list,"what is on my to do list"
todo_list,"what are the things that i have for today"
todo_list,"is cleaning the kitchen coming up on my list of things i have to do today"
todo_list,"do i already have a task on my todo list to research delaware"
todo_list,"what items do i need to do"
todo_list,"do i have an item on my todo list related to shopping"
todo_list,"what do i have on my need to do list"
todo_list,"please inform me of what tasks i have listed on my to do list"
todo_list,"does my errand list have goodwill on it"
todo_list,"did i create a task to clean the gutters on my list"
todo_list,"can you tell me the tasks on my to-do list"
todo_list,"i need to know what my to-do list is looking like"
todo_list,"tell me the content of my to do list today"
todo_list,"do i have get an oil change on my todo list"
todo_list,"can you look to see whether feeding the fish is on my to do list"
todo_list,"did i remember to add buy flowers to my chore list today"
todo_list,"i need to know what tasks are on my to-do list"
todo_list,"how many chores are on my todo list"
todo_list,"do i have brush my teeth on my todo list"
todo_list,"read my complete todo list to me"
todo_list,"tell me what is on the list of things to do"
todo_list,"i wonder what my to-do list looks like for today"
todo_list,"read to me my to do list"
todo_list,"tell me what things i need to accomplish per my to do list, please"
todo_list,"repeat my to do list to me, please"
todo_list,"can you tell me the items on my to do list"
todo_list,"please tell me all the items on my to do list right now"
todo_list,"have i set aside a time on my to do list to do my taxes"
todo_list,"do i have a car wash scheduled on my to do list"
todo_list,"i need to know if cleaning out the fridge is on my to do list"
todo_list,"let me hear my todo list"
todo_list,"did i add \"cleaning the foyer\" to my todo list yet"
todo_list,"did i put grocery shopping on my todo list"
todo_list,"give me my todo list"
todo_list,"have i told you to add washing dishes to my todo list"
todo_list,"read my todo list"
todo_list,"list my todo list items"
todo_list,"is \"cleaning the bathroom\" an item on my todo list"
todo_list,"tell me what's on my todo list"
todo_list,"read my to-do list items"
todo_list,"check on my to-do list items"
todo_list,"check what is on my to-do list"
todo_list,"what items are on my list of to-dos"
todo_list,"what is on my to-do list"
todo_list,"what kind of things do i have to do today"
todo_list,"what's on my todo list for today"
todo_list,"please tell me my todo list"
todo_list,"is it possible to read my to-do list again"
todo_list,"tell me my to-do list"
todo_list,"give me my to-do list"
todo_list,"can you see if paying garbage bill is on my todo list for this week"
change_accent,"will you please do the male british accent"
change_accent,"make the male british accent please"
change_accent,"could you please change your accent to the male british one"
change_accent,"for the love of all that good change your accent"
change_accent,"your accent needs to be changed"
change_accent,"please change your accent"
change_accent,"change your accent now"
change_accent,"change to a new accent please"
change_accent,"what other accents can you use"
change_accent,"i need to change my account"
change_accent,"i need to switch accounts"
change_accent,"please change my account to another one"
change_accent,"please use a male voice"
change_accent,"change over to the female voice"
change_accent,"i want to change what accent you use"
change_accent,"change to female voice"
change_accent,"try using a different accent"
change_accent,"go ahead and switch to the male voice"
change_accent,"switch to a different accent"
change_accent,"if you can do accents, i want to hear you talk like david bowie"
change_accent,"can you speak like a british dude"
change_accent,"please talk to me in the male british accent"
change_accent,"i would prefer to hear the female voice"
change_accent,"please change your accent to a british male"
change_accent,"i prefer female voice now"
change_accent,"set to female voice"
change_accent,"use your male voice"
change_accent,"please use a male voice when speaking"
change_accent,"can you use male voice"
change_accent,"use male voice"
change_accent,"use a male voice instead"
change_accent,"can i hear the male voice please"
change_accent,"switch over to the male voice mode"
change_accent,"use a male voice now"
change_accent,"use female voice now instead"
change_accent,"i want you to change your accent to the male british one"
change_accent,"could you talk like a british male"
change_accent,"go ahead and change your accent to the male british one"
change_accent,"switch to british male accent"
change_accent,"please use male voice"
change_accent,"go ahead and switch to the female voice"
change_accent,"can you swap to male voice"
change_accent,"i need for you to change your accent to the male british one"
change_accent,"please use your female voice"
change_accent,"speak in a different accent"
change_accent,"i want to hear the female voice option"
change_accent,"speak as a british male"
change_accent,"change the accent you're speaking in"
change_accent,"do a british male accent only"
change_accent,"change the accent you're using"
change_accent,"talk to me in a different accent"
change_accent,"change to the female voice"
change_accent,"i want to hear the female voice from now on"
change_accent,"i want the male voice"
change_accent,"could you use the female voice"
change_accent,"female voice please"
change_accent,"can you switch to the male voice"
change_accent,"the male voice please"
change_accent,"i want you to change your accent"
change_accent,"would you please switch to the male voice"
change_accent,"i would like you to change your accent"
change_accent,"change to girl voice"
change_accent,"change to the females voice please"
change_accent,"switch voice option to female"
change_accent,"change voice to female"
w2,"i need a w2 form, how do i get one"
w2,"who do i contact for a w2 form"
w2,"how do i get a w2 form"
w2,"who should i call for a w2"
w2,"where do i go to get a form for w2s"
w2,"where do i get w2 form"
w2,"i need to know where to get w2"
w2,"tell me where i should get the w2"
w2,"so where do i get the w2 form"
w2,"please tell me where to get the w2"
w2,"w-2 tax form where is it"
w2,"where's my w-2 tax form"
w2,"where do i find my w-2 tax form"
w2,"can i find my w-2 online"
w2,"where can i get the form for my taxes"
w2,"where can i get a w2 form"
w2,"can you access my w-2"
w2,"how do i get a personal w2 form"
w2,"i would like to get the forms to file for my w2"
w2,"can you tell me what the form is employers are supposed to send you for taxes and where i get it"
w2,"who has the tax form that shows my wages"
w2,"where can i obtain a w2 form from"
w2,"provide me assistance on where to go to get my w2 for tax reasons"
