oos,"a show on broadway"
oos,"who has the best record in the nfl"
oos,"how do i find the area of a circle"
oos,"what is the name of the 13th president"
oos,"does our bank have free notary"
oos,"what were the top stories this week"
oos,"when was the last time the president visited floridau"
oos,"how do i compute the median of a set of numbers"
oos,"can you tell me how to compute price per ounce"
oos,"how to unclog a drain"
oos,"what new reality shows are there for 2019"
oos,"what is the purpose or benefit of a cash advance"
oos,"how can i root an android phone"
oos,"is android better than iphone"
oos,"are androids expensive"
oos,"who are some famous living architects"
oos,"find out for me as to why people get autism"
oos,"is autism a genetic disease"
oos,"is flu contagious"
oos,"king of acid"
oos,"suo2"
oos,"what university in the united states offers the best biomedical engineering program"
oos,"when was electrical engineering created"
oos,"is it possible to survive in a black hole"
oos,"can you tell me the latest georgia news"
oos,"is the brexit finalized yet"
oos,"the birds fly with there wings"
oos,"how the birds fly"
oos,"is marijuana addictive"
oos,"should i hit or stay at 17 in blackjack"
oos,"what's the best opening gambit for a game of chess"
oos,"what side in chess has the general advantage"
oos,"how do i get better at go"
oos,"what'll an education at boulder state college run"
oos,"what's the average gpa to get into yale"
oos,"what act score is considered good"
oos,"how is crypto legal"
oos,"are there any cybersecurity jobs available in pittsburgh"
oos,"how can i breach a network"
oos,"how does cybersecurity work"
oos,"which nations are not democratic"
oos,"how does a democracy work"
oos,"what's the best dog food to feed my puppy"
oos,"how do you know when your dog is ill"
oos,"what dog breed sold the most in 2018"
oos,"how much food should i feed my cat"
oos,"is it bad to not remember your dreams"
oos,"why do we dream"
oos,"do ducks eat meat, vegetables, or both"
oos,"what is the friendliest breed"
oos,"what do geese eat"
oos,"what brand of earphones is the best reviewed of 2019"
oos,"are white and brown eggs any different"
oos,"where do eggs come from"
oos,"how can i easily replace a string on my guitar"
oos,"what site publishes the most fake news"
oos,"can you tell me some fake news"
oos,"why is there fake news"
oos,"how much has the dow changed today"
oos,"can you tell me how to solve simple algebraic equations with one variable"
oos,"can you dim the brightness of my screen"
oos,"can you see a hdmi cord"
oos,"what veggies can i pair with mushrooms"
oos,"at what age can someone get a card"
oos,"please find today's most read stories from the new york times todayi"
oos,"how do i get red wine out of a couch cushion"
oos,"can you tell me who sells dixie paper plates"
oos,"who invented the internet"
oos,"what is happening in politicsu"
oos,"what is the best way to clean ceiling fans"
oos,"what oil is best for chicken"
oos,"what is today's big article in the washington post"
oos,"has there been anything breaking this afternoon"
oos,"what are yahoo's top stories right now"
oos,"can you add a bag to my reservation"
oos,"can you auto-pilot the car"
oos,"wash windshield"
oos,"what is the population of south africa"
oos,"watch the fbi"
oos,"can you find the answer to number 26 in this algebra two textbook"
oos,"how to remove a stripped bolt"
oos,"which stocks have lost the least today"
oos,"who won the patriots game last nightu"
oos,"what are the different types of tvs"
oos,"do laundry"
oos,"how many miles does my car currently have"
oos,"close all internet tabs"
oos,"how do you treat an iron skillet"
oos,"how much has microsoft's stock changed over the last year"
oos,"what is the best product for removing soap scum"
oos,"park the car"
oos,"show me a list of top rated airlines"
oos,"can you delete my saved credit card"
oos,"did the supreme court nominee get approvedu"
oos,"which company has gone up the most today"
oos,"who were the superbowl 23 champions"
oos,"can you tell me how to clean a fish tank"
oos,"open cnn websiteo"
oos,"how do i make my android phone more secure"
oos,"i need to update my address"
oos,"what is that crunchy stuff on creme bruleo"
oos,"can you list all channels of a certain category"
oos,"where does jelly come from"
oos,"how would you rate the airport i am traveling to"
oos,"am i too old to be a sugar babyo"
oos,"what was the closing number of the nasdaq today"
oos,"has ko gone up or down"
oos,"what is my checking account number"
oos,"when should i remove my snow tires"
oos,"which stocks gained the most today"
oos,"what is the fee for a cash advance"
oos,"tell me about the earthquake in california that happened this morning"
oos,"change color contrast"
oos,"is the bank open on mlk day"
oos,"go and check the fridge"
oos,"can you tell me the score of the heat game"
oos,"can you mark this note as important"
oos,"can you tell me how to multiply two fractions"
oos,"i want to find a new car under $25000"
oos,"when is the next full moon"
oos,"should i do a complete stop at red lights"
oos,"how to be millionare"
oos,"when does the stock market update"
oos,"how can i get a better rate on my card"
oos,"open up internet browser"
oos,"what makes pi so mathematically important"
oos,"why can you have the square root of a negative number"
oos,"how much time do i have left on my 0% apr"
oos,"what are the highest-rated android phones"
oos,"find articles about the protests in parisi"
oos,"can you tell me how fast the average airplane enroute to california goes"
oos,"how does my current htc phone compare to other android phones"
oos,"what articles are written at the cnn site about the women's march"
oos,"when does napa close"
oos,"when will world war 3 begin"
oos,"what's going on in the world today"
oos,"what battery percentage is my phone at"
oos,"can you sign out of my bank login"
oos,"what is one standard deviation"
oos,"has the market been up or down since the beginning of this year"
oos,"how many moons does mars have"
oos,"what is the cashback rate for my credit card"
oos,"who has the best record in the nba"
oos,"what are some good games for my android phone"
oos,"can my grace period be extended any possible way"
oos,"how fast am i going"
oos,"how many people died in yesterday's storm"
oos,"how much memory do i have left on this phone"
oos,"can i set up mobile deposits"
oos,"sell three calls of of nvda"
oos,"what bills is congress talking about passing or blocking today"
oos,"how much data does my phone have left this month"
oos,"how much money would my house sell for"
oos,"how do i install new cabinets"
oos,"is there a fee for cancelling a flight i've booked"
oos,"search my contacts for the auto repair place"
oos,"does my carrier have coverage in europe"
oos,"is there a cheaper rate with another carrier for my mobile"
oos,"what are the limits in my phone plan"
oos,"how frequently is the bus running today"
oos,"is there a better bus route i should be taking"
oos,"what stores are at my local mall"
oos,"i need to get kalee added to my phone plan"
oos,"how long does it take the irs to issue a tax refund"
oos,"do you know if it is possible to close my savings account"
oos,"how hard is it to close a bank account at wells fargo"
oos,"add my wife as an authorized user to checking account 20905432"
oos,"i would like to upgrade to full coverage for my car"
oos,"where can i list my vehicle for sell"
oos,"what is the price to buy more data on my phone"
oos,"i need to add a person to my bank account"
oos,"i want to install new tiles in my kitchen"
oos,"what's the way for delta to cancel a flight"
oos,"read the phone number for mom in my phone contacts"
oos,"create a contact labeled mom"
oos,"do other providers have better coverage than my cell carrier"
oos,"does centurytel offer any better plans than the one i'm on"
oos,"what's going on in the world today, anything major"
oos,"what is the extra digits that are sometimes included on my zip code"
oos,"what's the extended zipcode for my address"
oos,"is there an alternate bus stop close to my home i can use"
oos,"how much of a refund will i get this year"
oos,"please take all my money out of my checking account and close the account"
oos,"what are cars like mine selling for online"
oos,"switch over to low power mode to preserve battery life"
oos,"can you recommend some fiction books"
oos,"what is the most popular movie currently in theaters"
oos,"what is the cheapest new car for this year"
oos,"i am looking for a suit for work"
oos,"i need to find a black suit under $100"
oos,"what is a good laptop for gaming"
oos,"show me laptops for sale that are under $2,000"
oos,"what kind of bonds do molecules have"
oos,"look up prices for parking at the airport over the weekend"
oos,"what is the best way for dealing with the airport"
oos,"what are my hours this week at work"
oos,"how many voicemails are currently in my inbox"
oos,"what channel is cw on"
oos,"what is the most rented movie this week"
oos,"i would like to find a stylish suit for a party"
oos,"what is the best reviewed laptop available on the market"
oos,"what is a good chemistry experiment to learn from"
oos,"how much is this years model of my car cost"
oos,"how do i best deal with the airport"
oos,"remind me of the address for my workplace please"
oos,"what time do i have to go to work today"
oos,"erase all voicemails in my inbox please"
oos,"what are some natural remedies to help ease stress"
oos,"what are some good methods of relieving stress"
oos,"how do you make sure a bridge doesn't fall down"
oos,"what is the median salary for someone with an engineering degree"
oos,"what size pipes are used for sinks"
oos,"what does water taste like"
oos,"what store has the best deals going on right now"
oos,"can you tell me the best time to visit downtown when driving"
oos,"am i currently connected to wifi"
oos,"tell me about personal finance"
oos,"does amazon collect my personal information"
oos,"check the status of my amazon orders for me"
oos,"list the contents of my safety deposit box at the bank"
oos,"what's the more secure bank vault"
oos,"how do i make money"
oos,"find engineering programs to apply to"
oos,"what kind of glue is used for gluing pipes together"
oos,"is anything on my grocery list on sale today"
oos,"please activate a wireless hotspot so i can use the internet"
oos,"look up a good broker for mutual funds"
oos,"what are the best personal finance practices"
oos,"will amazon ship an order even if there was a pricing mistake"
oos,"where did mandarin originate from"
oos,"what are some of the most visited countries for people looking to travel abroad"
oos,"what is my current signal strength"
oos,"if i'm locked in a bank vault what's the best way to get out"
oos,"how do i upgrade my operating system"
oos,"how do you fix a leaking sink"
oos,"how do you unclog a toilet"
oos,"can you tell me local crime in my area"
oos,"what's the power consumption of my fridge"
oos,"how do i get stains out of the carpet"
oos,"what is the highest quality carpet available"
oos,"are you allowed to call someone a dirty name as part of free speech"
oos,"can you really get arrested for yelling fire in a crowded theater"
oos,"where is the closest driving range"
oos,"are your step-parent's parents considered your grandparents"
oos,"what's a good gift to get for your grandparents"
oos,"fun gift ideas to give to grandparents"
oos,"how many greek mythology characters are there"
oos,"who created the world in greek mythology"
oos,"how many harry potter books are there"
oos,"what is harry's real name"
oos,"how do you repel a bear when you're out on a hike"
oos,"where's the best place to hike in the rockies"
oos,"what should i wear to hike"
oos,"what is the main cause of becoming homeless"
oos,"how many people are jobless in america"
oos,"how many homeless people are there"
oos,"are indians nowadays reminiscent of a decade ago"
oos,"i need tips on how to overcome insomnia"
oos,"how many people have insomnia"
oos,"what are sigmund freud's most famous books"
oos,"where is te lawrence"
oos,"what's the most practiced form of mma in the world"
oos,"what is the highest belt in karate"
oos,"where does jiu jitsu originate"
oos,"what kind of paint do makeup artists use"
oos,"the bus moves with tyre"
oos,"how the bus moves"
oos,"are people with a mental illness eligible for disability"
oos,"what's trending now"
oos,"what's the first romantic movie ever made"
oos,"what kind of traits do vampires have"
oos,"what do mummies eat"
oos,"what's the cost of buying a sump pump"
oos,"recommend a flood clean up service"
oos,"what is the safest model of airplane to fly in"
oos,"what year was the first airplane built in"
oos,"what's the best reviewed local roof repair place"
oos,"where can i buy new shingles"
oos,"tiger"
oos,"are there any apartments for rent nearby"
oos,"what's the highest building in the world"
oos,"where is the closest architecture college"
oos,"where can i submit my architecture plans"
oos,"how do they filter pollutants out of bottled water"
oos,"what's the cost to have a business card printed"
oos,"when can i get a business card printed locally"
oos,"download all the photos off my phone into the cloud"
oos,"tell me about that kind of cameras"
oos,"how much is the new nikon camera"
oos,"what kind of camera should i buy"
oos,"how much candy have i consumed this week"
oos,"who makes milky way bars"
oos,"what's the chemical composition of a fart"
oos,"what is phosphorus on the periodic table"
oos,"look up some christmas songs for me"
oos,"is espn covering the golden state warriors game"
oos,"what is a normal resting heart rate"
oos,"how many months do i left in my hbo subscription"
oos,"cancel my subscription to scientific american"
oos,"i'd like to renew my subscription to playboy"
oos,"what are popular lifestyle magazines"
oos,"what are popular sports magazines"
oos,"how can i use make up to cover a cut on my cheek"
oos,"send me videos of how to do a smoky eye"
oos,"whats the best rated lipstick"
oos,"when will the government file another antitrust suit against microsoft"
oos,"when will microsoft drop support for windows 7"
oos,"how do i make a sentence have stylized strike out in microsoft word"
oos,"i need for you to look up some of the major gods in mythology"
oos,"what was the original name of jesus in egyptian myth"
oos,"was the god osiris a titan or an old god"
oos,"tell me who aphrodite is"
oos,"when will the daffodils bloom this year"
oos,"can you check how many miles i walked today when i was out get the info from my phone"
oos,"what should i do if it hurts when i pee"
oos,"how many pokemon have i caught in my pokemon go app"
oos,"tell me what pokemon is"
oos,"has the school my kids go to been in the news for any reason"
oos,"how long is the school year"
oos,"what was the point of the crusades"
oos,"what other countries speak the english language"
oos,"do they speak english in australia"
oos,"who teaches english near me"
oos,"can you look at what the oldest age is someone can enlist in the army"
oos,"where are most the servicemen right now"
oos,"what time is a star is born showing"
oos,"can you get me the scores from the games that were played last night"
oos,"has there been any times when lebron james was arrested"
oos,"what are the new player rankings for the nhl"
oos,"tell me a list of my local papers"
oos,"would you let me know who won the gold metal in gymnastics at the olympics"
oos,"where will the next olympics be hosted"
oos,"when are the winter olympic games"
oos,"what films are in the running for best song at this year's oscars"
oos,"who are the nominees for best picture this year"
oos,"give me information on the oscars"
oos,"tell me about the oscars"
oos,"why did we elect this woman who made amazon leave and take its jobs with it"
oos,"what's a good way to organize my tools in my garage"
oos,"is there a fork in the road sign at main & 1st avenue"
oos,"are there cameras hidden in stop lights"
oos,"what universities are nearby to me and highly rated"
oos,"how safe is the herpes vaccine they give women"
oos,"where can i get the flu shot"
oos,"when do i have to get the mmr"
oos,"when will nightwish be touring through my city"
oos,"does iron maiden have any new releases"
oos,"can you tell me whether the knicks will play the lakers this week"
oos,"when do the kids get out of school today"
oos,"how much sugar was in my urine this morning"
oos,"what's a good blouse to wear with pink shoes"
oos,"how much does it cost to spay a puppy"
oos,"what's the best style shoe to wear to the prom"
oos,"can you tell me about that tornado that just tore up alabama"
oos,"what happened with the summit between trump and jong"
oos,"check and see what the local news in broadcasting"
oos,"upload the pictures to the correct album"
oos,"i have a super runny nose and want to find a doctor"
oos,"which medicine to relieve my cough"
oos,"how do i get rid of sore throat at home"
oos,"how to paint walls"
oos,"can you store a gun in a safe deposit box"
oos,"how do you get a safe deposit box"
oos,"where should i go if i hammered a nail through my foot"
oos,"do vegans really want to blame cows for climate change"
oos,"i need to hire a grass treatment specialist"
oos,"when is the best time of year for pruning"
oos,"find someone local who mows lawns"
oos,"create a speech on historical events surrounding albert einstein"
oos,"create a pamphlet on albert einsteins childhood"
oos,"what is albert einstein famous for"
oos,"when was albert einstein born"
oos,"is the movie avatar culturally insensitive"
oos,"does bill gates still have any material participation in the running of microsoft"
oos,"give me the weather forecast for today"
oos,"what is bitcoin trading for currently"
oos,"where can i have a black and white photo blown up to poster size"
oos,"can you colorize a black and white photo"
oos,"when will the next boston marathon be"
oos,"look up which animal is represented in this year's chinese new year"
oos,"what is the animal for this chinese new year"
oos,"would it be legal to have battles to the death in a homemade colosseum"
oos,"do the romans still use the colosseum for anything today"
oos,"where is the colosseum"
oos,"can you really time your compressions to queen's \"another one bites the dust\""
oos,"tell me how to perform cpr"
oos,"where are classes taught near me for c++"
oos,"declare a variable named \"golf\""
oos,"how do i write c++"
oos,"is the depiction of gold mining in the movie the ballad of buster scruggs realistic"
oos,"do you own the mineral rights to gold nuggets you find in your back yard"
oos,"where is the best place to mine for gold"
oos,"when was the gold rush"
oos,"what's the main export by the peoples of greenland"
oos,"how many people still live on greenland"
oos,"create several photos of me with different hair styles"
oos,"show video of hair styling tips"
oos,"did a man really die trying to be loved by a horse"
oos,"how many acres do you need to buy a horse"
oos,"get me a picture of a horse"
oos,"find out how many latin scholars there are at the university of chicago"
oos,"make a list of stocks that would be good to invest in to start making money"
oos,"how can i add my signature to the proposed bill legalizing prostitution"
oos,"what's the roi doing arbitrage with ebay"
oos,"do women still bare their chests for beads at mardi gras"
oos,"when's the next mardi gras going to be"
oos,"what is the best way to kill microbes"
oos,"start a speech on microbes for me"
oos,"what is the top 10 best modems"
oos,"does the nsa listen to me"
oos,"what do you do if your cat eats an octopus"
oos,"find out which museum houses the most post modern art in new york state"
oos,"look up the top 3 selling post modern artists in the united states"
oos,"create a portrait for me using post modern art"
oos,"find me examples of post modern art"
oos,"find the names of all the rain forests located in south america"
oos,"does cutting down the rain forest really add to global warming"
oos,"what's the current prevailing interest rate for mortgages in my area"
oos,"how's the real estate market doing this week"
oos,"please list my real estate for sale"
oos,"make an ad to sell my real estate"
oos,"what's the status of robotic servants from japan"
oos,"can a robot really travel back in time"
oos,"see if you can purchase a spacesuit online"
oos,"compile a folder of paintings of sparta"
oos,"display history of sparta"
oos,"start a portfolio on venture capital funding for me to look over"
oos,"how to plan for weddings"
oos,"what did my best friend do in the kitchen while we were gone"
oos,"is there any news if my parents survived the crash"
oos,"tell me who gives the best motivational speeches on the web"
oos,"send me a motivational quote everyday for the next week"
oos,"tell me where i can get more information on getting a job at the post office"
oos,"help me find a new position as a programmer"
oos,"what's the best career search website"
oos,"give me a list of the biographies written by nyu professors after 2001"
oos,"i would like for you to start a biography on me"
oos,"show me all biographies on teddy kennedy"
oos,"find out what supplies i am missing and will need on my upcoming camping trip"
oos,"what are the camping restrictions at bear island"
oos,"show me what one should do to get ahead in a tech corporation"
oos,"look up ways for me to advance my job placement"
oos,"see if there is a recipe to make a casserole without any dairy"
oos,"tell me in how many different colors i can get dinner plates from pier one imports"
oos,"look up the conversion rate for the euro to dollar exchange"
oos,"how do i put a lens that's fallen out back in my glasses"
oos,"i need you to order a new pair of eyeglasses for me"
oos,"show me examples of cute eyeglass frames"
oos,"tell me how to get rid of a spirit that's haunting me"
oos,"show me how to contact a paranormal spirit"
oos,"make a list of goals i need to meet in order to write a book"
oos,"remind me what my weight loss goals are"
oos,"give me a list of tax attorneys that practice in my city"
oos,"tell me how i can file a pleading in circuit court"
oos,"what are the top rated local lawyers"
oos,"tell me what the longest tributary is in venezuela"
oos,"please book another boat for this weekends trip"
oos,"get me a list of universities that provide full scholarships in arizona"
oos,"tell me where to go to get my son enrolled in public kindergarten"
oos,"do a job search on monstercom for jobs in the tech field in arlington, va"
oos,"i need to find work, help me connect to a local business through linkedin"
oos,"give me a list of the top 5 issues people have in this country"
oos,"what is the government department that regulates emissions"
oos,"explain to me the process of evaporation"
oos,"tell me how to make a lesson plan"
oos,"tell me where i can get the cheapest tennis balls on the internet"
oos,"play the current tennis match on the tv in the living room"
oos,"make a chart of all the tennis scores from this year"
oos,"find the best prices for toothpaste at any store within a 5 mile radius of my location"
oos,"what's the best price on a gray xl ll bean men's parka"
oos,"how do i set the time on my tag heuer"
oos,"give me prices on a copy of the mla grammar handbook"
oos,"put into words what you want"
oos,"what kind of foods are border collies allergic to"
oos,"look up daily dog kennels in my area"
oos,"call the grocery store and get their operational hours"
oos,"call an uber to take me to the closest grocery store"
oos,"are all the street lamps working on my street"
oos,"make a list of all community gardens near me"
oos,"tell me where to send my resume in order to get a job at delta airlines"
oos,"please spell check my resume"
oos,"where can i get 100% merino wool t-shirts on the internet"
oos,"show me all listings on amazon for leather belts for men"
oos,"search up someone who plays in a movie"
oos,"tell me about the amusement park"
oos,"take a ride on the ferris wheel"
oos,"go on the ferris wheel"
oos,"compare prices of malt-o-meal to kelloggs"
oos,"search all movies created by disney in the 1980's"
oos,"does disney world close when it storms"
oos,"what are the hours for disney world"
oos,"what time did i get the last text message i received"
oos,"watch the stories on instagram"
oos,"update my status on instagram"
oos,"can you check on what it would cost me to upgrade my iphone with t-mobile"
oos,"please alert me when my iphone battery falls below 30%"
oos,"what are the requirements of a lab technician"
oos,"generate a list of 20 songs that include the word love in the title"
oos,"create a 500 word letter expressing love"
oos,"what does the average cost of an engagement ring"
oos,"what is popular in fashion right now"
oos,"does denim go with anything"
oos,"accept incoming phone call"
oos,"deny incoming phone call"
oos,"what do i wear on my feet when it rains"
oos,"what do i put on my feet"
oos,"what are the words to the chorus for this song"
oos,"display the song lyrics for me"
oos,"clear my search history"
oos,"compare the new life growth in trees when the seasons change"
oos,"find a good toy to give a 5 year old boy that costs less than $40"
oos,"look on amazon for the price of a nitendo switch"
oos,"what brand was the last advertisement for"
oos,"i watched \"were the millers\" on netflix last night"
oos,"how many people have held the role of county attorney bearing the family name \"dixon\""
oos,"tell me about the candidates running for local office in my area"
oos,"find out who is the representative of my district"
oos,"look up the email address of the local police"
oos,"how many hits have i done today"
oos,"change out the older photos with the newer ones"
oos,"can you group my photos by location"
oos,"look up the operating hours of my local park on weekends"
oos,"how many parks are within 20 miles of me"
oos,"check to see if i still have allergy medication"
oos,"how long should an essay be"
